{
    "schema_version":  1,
    "generated_at":  "2026-09-16T08:49:22.0669638Z",
    "layer_version":  "1.5.1",
    "artifact_count":  176,
    "total_bytes":  288290,
    "token_estimate":  72146,
    "artifacts":  [
                      {
                          "kind":  "adapter",
                          "path":  "adapters/claude-code/adapter.json",
                          "sha256":  "bc9d0dc5a5fdbbb486e25acfc5c836d44e00c84111dc31430b9f689ada189ba6",
                          "bytes":  804,
                          "lines":  24,
                          "words":  74,
                          "token_estimate":  201
                      },
                      {
                          "kind":  "adapter",
                          "path":  "adapters/claude-code/CLAUDE.lizard.md",
                          "sha256":  "004a699e84febcac566877b285f7267ed6f03eaabefd1b5745e991565e9482f4",
                          "bytes":  1691,
                          "lines":  20,
                          "words":  232,
                          "token_estimate":  423
                      },
                      {
                          "kind":  "adapter",
                          "path":  "adapters/codex/adapter.json",
                          "sha256":  "6050f76bd2f55bf159ea84b15e7d1b38bb4d068067ce3300f62187ef3a9ad31c",
                          "bytes":  884,
                          "lines":  28,
                          "words":  80,
                          "token_estimate":  221
                      },
                      {
                          "kind":  "adapter",
                          "path":  "adapters/codex/AGENTS.lizard.md",
                          "sha256":  "8d20fd21e150365e86f4e3723df9604e254f5f52a6286c64dbdfe7f37ce91072",
                          "bytes":  1685,
                          "lines":  20,
                          "words":  231,
                          "token_estimate":  422
                      },
                      {
                          "kind":  "adapter",
                          "path":  "adapters/cursor/adapter.json",
                          "sha256":  "316084cb3293ac09208038e00bad16b62943cbcc9fcf564e2ac56c0eb9611a42",
                          "bytes":  688,
                          "lines":  23,
                          "words":  54,
                          "token_estimate":  172
                      },
                      {
                          "kind":  "adapter",
                          "path":  "adapters/cursor/lizard-agent-layer.mdc",
                          "sha256":  "005211226804626b68640a63ff4d9a20aa0f4af6f70c8e189781837381f2d71f",
                          "bytes":  1807,
                          "lines":  25,
                          "words":  246,
                          "token_estimate":  452
                      },
                      {
                          "kind":  "adapter",
                          "path":  "adapters/gemini/adapter.json",
                          "sha256":  "a31998a4e5b7c917da40102ad8cb15702dfc645fafa75c22aba4657a340aea6e",
                          "bytes":  784,
                          "lines":  24,
                          "words":  72,
                          "token_estimate":  196
                      },
                      {
                          "kind":  "adapter",
                          "path":  "adapters/gemini/GEMINI.lizard.md",
                          "sha256":  "be4651a97e3970a97f0065743ebfe1b34865eb872e60997f56b6ef3d55373c9e",
                          "bytes":  1686,
                          "lines":  20,
                          "words":  231,
                          "token_estimate":  422
                      },
                      {
                          "kind":  "adapter",
                          "path":  "adapters/generic-agents-md/adapter.json",
                          "sha256":  "5f6c9c81d6139e2fc0e130b174f1ef890230e9d3ff5652aab9ec373732e4e336",
                          "bytes":  693,
                          "lines":  25,
                          "words":  57,
                          "token_estimate":  174
                      },
                      {
                          "kind":  "adapter",
                          "path":  "adapters/generic-agents-md/AGENTS.generic.lizard.md",
                          "sha256":  "b4f43d5787d9a24f954f657425b8e8ad339116693484f480e6988132ee96fb0a",
                          "bytes":  1674,
                          "lines":  20,
                          "words":  229,
                          "token_estimate":  419
                      },
                      {
                          "kind":  "adapter",
                          "path":  "adapters/github-copilot/adapter.json",
                          "sha256":  "aadb75c620acfb1fcb33734fc99d9d9d13a24aad0925bf9a53ed4504740abab8",
                          "bytes":  738,
                          "lines":  25,
                          "words":  49,
                          "token_estimate":  185
                      },
                      {
                          "kind":  "adapter",
                          "path":  "adapters/github-copilot/copilot-instructions.lizard.md",
                          "sha256":  "acfb3d4ce07d42d3c1e3b4b0e854b3e797f78535c92a3148c3f3a5bdc928f0f0",
                          "bytes":  1693,
                          "lines":  20,
                          "words":  232,
                          "token_estimate":  424
                      },
                      {
                          "kind":  "skill",
                          "path":  "skills/agent-runtime/skill.json",
                          "sha256":  "7c2fb55f103429b7e4400620d43b20da5be512f5b2c28f16ae3cb6cab9da6c6d",
                          "bytes":  1235,
                          "lines":  56,
                          "words":  87,
                          "token_estimate":  309
                      },
                      {
                          "kind":  "skill",
                          "path":  "skills/agent-runtime/SKILL.md",
                          "sha256":  "39056b1c843d6c8064c9427ab168553d24669f2fe43f0a4956ba30cbc864e6d4",
                          "bytes":  1256,
                          "lines":  28,
                          "words":  175,
                          "token_estimate":  314
                      },
                      {
                          "kind":  "skill",
                          "path":  "skills/backend-api/skill.json",
                          "sha256":  "14c76c7ff7b3d941a3de1c6c99550d9378f62831cb0d74d3e5aefdb449ae343c",
                          "bytes":  1231,
                          "lines":  56,
                          "words":  87,
                          "token_estimate":  308
                      },
                      {
                          "kind":  "skill",
                          "path":  "skills/backend-api/SKILL.md",
                          "sha256":  "5a0b86a4ca32d83b6265195a3ba8debc4172ff5a11bf9e6df48671025893ecbb",
                          "bytes":  1564,
                          "lines":  28,
                          "words":  211,
                          "token_estimate":  391
                      },
                      {
                          "kind":  "skill",
                          "path":  "skills/ci-triage/skill.json",
                          "sha256":  "30fe916d101db06cb999ace426e44297e52ec8717d78cc7e389b72e1f5c39b98",
                          "bytes":  1227,
                          "lines":  56,
                          "words":  87,
                          "token_estimate":  307
                      },
                      {
                          "kind":  "skill",
                          "path":  "skills/ci-triage/SKILL.md",
                          "sha256":  "cf19ea0f29c0d3a676649d1181b5a2fe1f00ff07c7b051d01259a9c19c8b674a",
                          "bytes":  999,
                          "lines":  41,
                          "words":  148,
                          "token_estimate":  250
                      },
                      {
                          "kind":  "skill",
                          "path":  "skills/database-engineering/skill.json",
                          "sha256":  "691656c0dc531d96de1a85070e996704ba697035b7f6d237433e9f17ef017752",
                          "bytes":  1249,
                          "lines":  56,
                          "words":  87,
                          "token_estimate":  313
                      },
                      {
                          "kind":  "skill",
                          "path":  "skills/database-engineering/SKILL.md",
                          "sha256":  "9b205310fd19eb5d87ce8c492beb4b936f9bde7d7bcb7a734a6c8153778ee897",
                          "bytes":  1702,
                          "lines":  28,
                          "words":  229,
                          "token_estimate":  426
                      },
                      {
                          "kind":  "skill",
                          "path":  "skills/data-quality/skill.json",
                          "sha256":  "a20bff8999e58ae153b8b84a430ff35a855fba05b96b92d4e353ea69d23f65bf",
                          "bytes":  1233,
                          "lines":  56,
                          "words":  87,
                          "token_estimate":  309
                      },
                      {
                          "kind":  "skill",
                          "path":  "skills/data-quality/SKILL.md",
                          "sha256":  "c18311abe74be73b2717f3427248f8c5de8971e82537ac41042fe51a0dd65ae2",
                          "bytes":  487,
                          "lines":  15,
                          "words":  73,
                          "token_estimate":  122
                      },
                      {